{
  "id": "jyotish-profile-coaching",
  "outcome": "A saved birth profile is really stored, ages are right in every time zone, and coaching is never stored against a superseded chart",
  "state": "active",
  "expected_surface": [
    "examples/astro/astro.py",
    "examples/astro/test_astro.py"
  ],
  "exclusions": [
    "ephemeris accuracy",
    "coaching prompt wording",
    "voluntary contribution (UPI) flow"
  ],
  "verification": "python3 -m unittest examples.astro.test_astro -v",
  "claims": [
    "saving a profile reports synced only when the profile is stored",
    "age is correct for users behind and ahead of UTC",
    "coaching started before a birth-time correction is not stored against the old chart",
    "invalid birth details are rejected and store nothing"
  ]
}
